"Status","Start Time","Stop Time","Duration in ms","Parent Suite","Suite","Sub Suite","Test Class","Test Method","Name","Description"
"passed","Wed Mar 01 22:26:28 GMT 2023","Wed Mar 01 22:26:36 GMT 2023","7755","","","","","","Update the Due Date of an item succesfully",""
"passed","Wed Mar 01 22:30:55 GMT 2023","Wed Mar 01 22:31:01 GMT 2023","6426","","","","","","View account settings succesfully",""
"passed","Wed Mar 01 22:30:47 GMT 2023","Wed Mar 01 22:30:54 GMT 2023","7061","","","","","","Update password succesfully",""
"passed","Wed Mar 01 22:28:17 GMT 2023","Wed Mar 01 22:28:34 GMT 2023","16461","","","","","","Delete a pending item succesfully",""
"passed","Wed Mar 01 22:26:56 GMT 2023","Wed Mar 01 22:27:03 GMT 2023","6856","","","","","","Checking and unchecking an Item in a Project successfully",""
"passed","Wed Mar 01 22:26:38 GMT 2023","Wed Mar 01 22:26:45 GMT 2023","7698","","","","","","Update the Due Date of an item succesfully",""
"passed","Wed Mar 01 22:25:29 GMT 2023","Wed Mar 01 22:25:37 GMT 2023","8718","","","","","","Postpone the Due Date of an item succesfully",""
"passed","Wed Mar 01 22:31:14 GMT 2023","Wed Mar 01 22:31:21 GMT 2023","6489","","","","","","View pro settings succesfully",""
"passed","Wed Mar 01 22:25:50 GMT 2023","Wed Mar 01 22:25:58 GMT 2023","8174","","","","","","Postpone the Due Date of an item succesfully",""
"passed","Wed Mar 01 22:31:28 GMT 2023","Wed Mar 01 22:31:35 GMT 2023","7436","","","","","","Update time zone succesfully",""
"passed","Wed Mar 01 22:30:25 GMT 2023","Wed Mar 01 22:30:32 GMT 2023","6858","","","","","","Fail to update full name with empty input",""
"passed","Wed Mar 01 22:29:55 GMT 2023","Wed Mar 01 22:30:01 GMT 2023","6670","","","","","","Empty the recycle bin succesfully",""
"broken","Wed Mar 01 22:28:10 GMT 2023","Wed Mar 01 22:28:15 GMT 2023","5659","","","","","","Create an Item Successfully",""
"passed","Wed Mar 01 22:28:57 GMT 2023","Wed Mar 01 22:29:04 GMT 2023","6217","","","","","","Create a new project",""
"passed","Wed Mar 01 22:27:21 GMT 2023","Wed Mar 01 22:27:27 GMT 2023","6389","","","","","","Place item priority",""
"passed","Wed Mar 01 22:28:44 GMT 2023","Wed Mar 01 22:28:50 GMT 2023","6600","","","","","","Add a project above",""
"passed","Wed Mar 01 22:24:25 GMT 2023","Wed Mar 01 22:24:35 GMT 2023","9698","","","","","","Postpone the Due Date of an item succesfully",""
"passed","Wed Mar 01 22:28:51 GMT 2023","Wed Mar 01 22:28:57 GMT 2023","6367","","","","","","Add a project below",""
"passed","Wed Mar 01 22:30:32 GMT 2023","Wed Mar 01 22:30:39 GMT 2023","7345","","","","","","Update full name succesfully",""
"passed","Wed Mar 01 22:26:00 GMT 2023","Wed Mar 01 22:26:08 GMT 2023","8044","","","","","","Postpone the Due Date of an item succesfully",""
"passed","Wed Mar 01 22:31:42 GMT 2023","Wed Mar 01 22:31:49 GMT 2023","6319","","","","","","Logout off the site succesfully",""
"passed","Wed Mar 01 22:29:04 GMT 2023","Wed Mar 01 22:29:21 GMT 2023","16140","","","","","","Delete a project",""
"broken","Wed Mar 01 22:27:46 GMT 2023","Wed Mar 01 22:27:52 GMT 2023","6183","","","","","","Successfully addition of an item above or below an existing item",""
"passed","Wed Mar 01 22:27:13 GMT 2023","Wed Mar 01 22:27:19 GMT 2023","6121","","","","","","Place item priority",""
"passed","Wed Mar 01 22:31:36 GMT 2023","Wed Mar 01 22:31:42 GMT 2023","6123","","","","","","Login into the site succesfully",""
"passed","Wed Mar 01 22:25:08 GMT 2023","Wed Mar 01 22:25:16 GMT 2023","8598","","","","","","Postpone the Due Date of an item succesfully",""
"passed","Wed Mar 01 22:30:01 GMT 2023","Wed Mar 01 22:30:08 GMT 2023","6868","","","","","","Fail to update email with an existing email",""
"passed","Wed Mar 01 22:27:05 GMT 2023","Wed Mar 01 22:27:11 GMT 2023","6299","","","","","","Place item priority",""
"passed","Wed Mar 01 22:24:57 GMT 2023","Wed Mar 01 22:25:06 GMT 2023","8709","","","","","","Postpone the Due Date of an item succesfully",""
"passed","Wed Mar 01 22:26:10 GMT 2023","Wed Mar 01 22:26:17 GMT 2023","7145","","","","","","Update the Due Date of an item succesfully",""
"passed","Wed Mar 01 22:30:08 GMT 2023","Wed Mar 01 22:30:15 GMT 2023","7002","","","","","","Fail to update email with empty input",""
"passed","Wed Mar 01 22:30:40 GMT 2023","Wed Mar 01 22:30:47 GMT 2023","7006","","","","","","Fail to update password with empty input",""
"passed","Wed Mar 01 22:26:19 GMT 2023","Wed Mar 01 22:26:26 GMT 2023","7319","","","","","","Update the Due Date of an item succesfully",""
"passed","Wed Mar 01 22:28:02 GMT 2023","Wed Mar 01 22:28:08 GMT 2023","5569","","","","","","View More Options Successfully",""
"passed","Wed Mar 01 22:29:31 GMT 2023","Wed Mar 01 22:29:37 GMT 2023","6148","","","","","","Drang and drop inside another project",""
"passed","Wed Mar 01 22:29:22 GMT 2023","Wed Mar 01 22:29:29 GMT 2023","6926","","","","","","Drag and drop above another project",""
"passed","Wed Mar 01 22:24:47 GMT 2023","Wed Mar 01 22:24:55 GMT 2023","8473","","","","","","Postpone the Due Date of an item succesfully",""
"passed","Wed Mar 01 22:29:47 GMT 2023","Wed Mar 01 22:29:54 GMT 2023","6611","","","","","","Edit a project",""
"passed","Wed Mar 01 22:25:39 GMT 2023","Wed Mar 01 22:25:48 GMT 2023","8363","","","","","","Postpone the Due Date of an item succesfully",""
"passed","Wed Mar 01 22:31:02 GMT 2023","Wed Mar 01 22:31:08 GMT 2023","6259","","","","","","View default settings succesfully",""
"passed","Wed Mar 01 22:27:29 GMT 2023","Wed Mar 01 22:27:36 GMT 2023","6208","","","","","","Place item priority",""
"passed","Wed Mar 01 22:31:21 GMT 2023","Wed Mar 01 22:31:28 GMT 2023","6600","","","","","","View share settings succesfully",""
"passed","Wed Mar 01 22:30:15 GMT 2023","Wed Mar 01 22:30:24 GMT 2023","8527","","","","","","Update email succesfully",""
"broken","Wed Mar 01 22:27:38 GMT 2023","Wed Mar 01 22:27:44 GMT 2023","6047","","","","","","Successfully addition of an item above or below an existing item",""
"passed","Wed Mar 01 22:24:37 GMT 2023","Wed Mar 01 22:24:45 GMT 2023","8361","","","","","","Postpone the Due Date of an item succesfully",""
"broken","Wed Mar 01 22:28:35 GMT 2023","Wed Mar 01 22:28:42 GMT 2023","6415","","","","","","Update a name of an item succesfully",""
"passed","Wed Mar 01 22:31:08 GMT 2023","Wed Mar 01 22:31:14 GMT 2023","6460","","","","","","View profile settings succesfully",""
"passed","Wed Mar 01 22:29:39 GMT 2023","Wed Mar 01 22:29:45 GMT 2023","6043","","","","","","Change a project image",""
"passed","Wed Mar 01 22:27:54 GMT 2023","Wed Mar 01 22:28:01 GMT 2023","7033","","","","","","View Less Options Successfully",""
"passed","Wed Mar 01 22:26:48 GMT 2023","Wed Mar 01 22:26:54 GMT 2023","6413","","","","","","Checking and unchecking an Item in a Project successfully",""
"passed","Wed Mar 01 22:25:18 GMT 2023","Wed Mar 01 22:25:27 GMT 2023","8443","","","","","","Postpone the Due Date of an item succesfully",""
